{"abstention_reasons":[],"calculations":[{"calculation_result_id":"CALC-286A03B92A790093474C","comparison":"NOT_APPLICABLE","display_result":"0.004861111111111111111111111111","error_codes":[],"formula_id":"DRAWING_SCALE","formula_manifest_hash":"da00ecf56f942a82bf26a7ddd701f47be8dc7ef3ecf0ea550ca90212cad1185f","formula_version":"1.0.0","inputs":{"pixel_length":"7200","real_length":"35.0"},"raw_result":"0.004861111111111111111111111111","result_hash":"e683c94768e7a5086b15a4ebc6b30ce6535a6c9ff94a361f95796e83f7dcbd83","status":"SUCCESS","substitution":"35.0 / 7200 = 0.004861111111111111111111111111"}],"case_id":"browser-case-v12","claims":[],"compatibility_source_version":null,"confidence":null,"confirmed_inputs":[{"candidate_status":"ACCEPTED","confirmation_record":"confirmations/20260805T164412Z-REV-16ED5B8BCB1A07CE6B14-CONF-08F11397FA594C41E73F8BEA.json","confirmation_sha256":"50efe411c2443b7605d1881c05e493c9280510c7dc6956613be0d5ab5d9a5e8c","evidence_id":"CAND-SAMPLE-PAGE17","field":"DRAWING_REAL_LENGTH","geometry":{"coordinate_system":"IMAGE_TOP_LEFT_PIXELS","coordinates":[[1200.0,900.0],[8400.0,900.0],[8400.0,5800.0],[1200.0,5800.0],[1200.0,900.0]],"type":"POLYGON"},"input_id":"CAL-BC494DBF45B3B4B31E0C777F","page":1,"source_sha256":"015e0f41d147f2c7e7f276e2b8379b905d9de93a678da84579200d1c11c0e96f","status":"CONFIRMED","unit":"m","value":"35.0"}],"conflicts":[],"drawing_evidence":[{"annotation_id":null,"candidate_id":"CAND-SAMPLE-PAGE17","candidate_type":"SITE_BOUNDARY","extractor":"PR58_BROWSER_FIXTURE","extractor_version":"1.0.0","geometry":{"coordinate_system":"IMAGE_TOP_LEFT_PIXELS","coordinates":[[1200.0,900.0],[8400.0,900.0],[8400.0,5800.0],[1200.0,5800.0],[1200.0,900.0]],"type":"POLYGON"},"normalized_candidate":null,"origin":"EXTRACTOR","page":1,"raw_value":null,"source_sha256":"015e0f41d147f2c7e7f276e2b8379b905d9de93a678da84579200d1c11c0e96f","status":"UNCONFIRMED"}],"evidence":[],"exceptions":[],"finalizer_status":"READY_FOR_HUMAN_REVIEW","format":"evidence-review/review-packet","formula_manifest_sha256":"da00ecf56f942a82bf26a7ddd701f47be8dc7ef3ecf0ea550ca90212cad1185f","human_decision":null,"question":"Review confirmed drawing calibration evidence.","rule_evaluations":[],"rule_manifest_sha256":"c4d41a402d39fea712a7ba6d80568595ef7be6fc1acc9cb63416b8c75020af76","run_id":"RUN-i9EXrsBJEzDRtYMOahpO","snapshot_sha256":"015e0f41d147f2c7e7f276e2b8379b905d9de93a678da84579200d1c11c0e96f","version":2}
